index	feedback_id	text	cluster_label	is_labeled	label	labeled
251	4	could benefit from clearer guidelines on documentation standards	2	False		False
252	565	i'm not leveraging peer reviews to improve my work quality.	11	False		False
253	670	i'm not utilizing the mentorship program enough to gain insights into leadership development.	3	False		False
254	532	the course content is too advanced for beginners; more foundational lessons are needed.	10	False		False
255	804	course content needs more emphasis on critical thinking and application of concepts.	10	False		False
256	955	there's a lack of clear direction from leadership, which affects team motivation.	2	False		False
257	778	implementing regular peer coaching sessions would enhance team growth.	12	False		False
258	691	the team needs better tools for collaborative problem-solving during project execution.	12	False		False
259	332	the team's use of feedback is inconsistent; providing training on its implementation could help.	6	False		False
260	197	limited access to learning resources outside core responsibilities	5	False		False
261	314	my reluctance to ask for help leads to inefficiencies; fostering a culture of inquiry would improve teamwork.	12	False		False
262	92	few opportunities to share knowledge with peers	12	False		False
263	444	i should track my progress more systematically to identify areas for improvement.	8	False		False
264	243	the course's content assumes prior knowledge not explicitly covered; adding prerequisite modules would help.	10	False		False
265	858	course content needs more emphasis on critical thinking and application of concepts.	10	False		False
266	202	the course's pacing left some students behind; adjusting the syllabus to allow for review might help.	10	False		False
267	333	the course's content delivery is passive; incorporating real-world case studies would improve relevance.	10	False		False
268	635	the team's feedback process lacks follow-up mechanisms to ensure action items are completed.	2	False		False
269	7	ideas are often dismissed without proper consideration	9	False		False
270	563	i should prioritize tasks based on their impact and urgency.	11	False		False
271	623	the peer feedback system could include anonymous options to encourage more candid input.	6	False		False
272	788	team members should be trained in basic project management principles.	12	False		False
273	578	frequent conflicts in team roles create confusion and inefficiency.	2	False		False
274	46	need clearer expectations for when to seek assistance	11	False		False
275	942	i should focus on time-blocking techniques to increase productivity during work hours.	0	False		False
276	203	my time management during projects often slips; i need to set clearer daily priorities.	0	False		False
277	862	course instructors need to provide more personalized guidance for struggling students.	1	False		False
278	265	the course's content doesn't address real-world applications; integrating industry case studies would help.	10	False		False
279	666	i struggle to accept feedback without feeling defensive, which hinders personal growth.	6	False		False
280	686	i often focus on minor issues rather than addressing the root causes of productivity challenges.	11	False		False
281	57	few clear guidelines on how to handle project delays	9	False		False
282	229	the team's workflow lacks automation; identifying repetitive tasks for tooling could free up time.	2	False		False
283	232	the project's risk assessment was overlooked, leading to unforeseen issues.	14	False		False
284	976	i need to enhance my ability to present data in a way that is easy for others to understand.	4	False		False
285	38	frequent task reassignments without explanation are confusing	11	False		False
286	496	i'm not taking enough time to reflect on my work and identify areas for improvement.	11	False		False
287	484	i should use a task tracker to monitor progress on my projects.	11	False		False
288	842	team members should be encouraged to share their unique perspectives more freely.	12	False		False
289	201	i find the current workflow inefficient; adding a task tracker could reduce bottlenecks.	7	False		False
290	665	the team's decision-making process lacks structured input from all members.	2	False		False
291	924	i must practice active listening to better understand client needs during meetings.	4	False		False
292	503	the course isn't providing enough opportunities for hands-on practice.	13	False		False
293	408	frequent interruptions during meetings reduce focus and efficiency.	0	False		False
294	660	i tend to avoid giving feedback that might seem confrontational, even when it's needed.	6	False		False
295	871	i should focus on building stronger relationships with mentors for guidance.	3	False		False
296	776	course instructors need to provide more detailed written feedback on assignments.	1	False	medium	True
297	134	must work on accepting feedback without defensiveness	6	False		False
298	39	could improve my ability to give specific, actionable feedback	6	False		False
299	176	few opportunities to share knowledge with peers	12	False		False
300	110	must work on managing my time more effectively	0	False		False
301	740	course content is outdated in several areas and needs updating.	10	False		False
302	22	few opportunities exist for skill development outside core responsibilities	8	False		False
303	841	i must improve my ability to organize complex information clearly.	8	False		False
304	692	i should develop a routine for reflecting on my interactions to improve communication effectiveness.	4	False		False
305	125	could benefit from more practice in time management	0	False		False
306	169	limited access to learning resources outside core responsibilities	5	False		False
307	631	the team needs better tools for tracking shared knowledge and reducing information silos.	12	False		False
308	845	i should focus on improving my ability to think strategically about long-term goals.	8	False		False
309	980	i need to refine my ability to handle multiple tasks without compromising quality.	7	False		False
310	717	team members should rotate leadership roles to develop diverse skills.	12	False		False
311	619	the course syllabus could better align with industry standards to ensure practical relevance.	10	False		False
312	705	the team's communication channels could be better organized to reduce information overload.	12	False		False
313	458	i need to practice asking for clarification when instructions are unclear.	1	False		False
314	476	i'm not utilizing available mentorship opportunities to improve my skills.	3	False		False
315	387	the project's timeline didn't allow for adequate risk analysis.	14	False	medium	True
316	220	i find myself overcommitting; learning to say no could improve focus.	4	False		False
317	49	could improve my ability to ask clarifying questions	4	False		False
318	675	the course modules need better alignment with industry trends to ensure relevance.	10	False		False
319	380	the team's knowledge-sharing is ad hoc; scheduling regular workshops would enhance collaboration.	12	False		False
320	437	i need to improve my ability to accept feedback without defensiveness.	6	False		False
321	892	workshops on negotiation skills could improve conflict resolution and agreement outcomes.	12	False		False
322	831	i need to be more open to receiving constructive criticism without defensiveness.	4	False		False
323	618	i've been delegating complex tasks without adequate check-ins, leading to inconsistent results.	11	False		False
324	685	the team needs better systems for tracking and implementing process improvements.	2	False		False
325	431	i need to practice active listening during meetings.	4	False		False
326	153	could benefit from more practice in time management	0	False		False
327	965	there's a lack of recognition for team members' hard work, which demotivates the group.	2	False		False
328	519	i should use a task tracker to monitor progress on my projects.	11	False		False
329	56	must work on giving feedback without sounding accusatory	6	False		False
330	915	the workflow process could be optimized to reduce redundant steps in task completion.	7	False		False
331	462	i need to improve my ability to give and receive feedback professionally.	4	False		False
332	587	i need to practice being more assertive in expressing my ideas.	4	False		False
333	219	the course's reading materials are too dense; suggesting summaries or guides could aid comprehension.	10	False		False
334	136	few opportunities to practice time management techniques	0	False		False
335	320	the team's use of terminology is inconsistent; creating a shared glossary would improve alignment.	2	False		False
336	935	team members rarely acknowledge each other's contributions, impacting morale.	2	False		False
337	305	the course's content is too theoretical; including real-world applications would improve relevance.	10	False		False
338	872	creating a shared calendar system would help with team coordination.	12	False		False
339	847	i must be more mindful of how my communication style affects team dynamics.	12	False		False
340	500	i should use project management tools to better organize my workflow.	7	False		False
341	996	i need to practice better prioritization techniques to avoid burnout.	7	False		False
342	331	the project's scope creep wasn't managed effectively; enforcing change control processes would improve planning.	9	False		False
343	517	i need to improve my ability to ask for help when needed.	4	False		False
344	418	i'm not asking for help when i need it, which delays progress.	11	False		False
345	713	i should focus more on time management to prevent missed deadlines.	0	False		False
346	991	the feedback i receive often lacks actionable steps for improvement.	6	False		False
347	699	the training program lacks opportunities to practice applying concepts under time pressure.	13	False		False
348	473	the course isn't providing enough opportunities for hands-on practice.	13	False		False
349	512	the course syllabus is too rigid; more flexibility would benefit learners.	10	False		False
350	710	i should focus more on developing active listening skills to improve team communication.	4	False		False
351	415	i should take online courses to enhance my technical skills.	8	False		False
352	865	i should focus on improving my ability to think strategically about long-term goals.	8	False		False
353	102	must work on developing better documentation habits	2	False		False
354	105	limited understanding of how to handle constructive criticism	4	False		False
355	280	the team's knowledge is not shared effectively; implementing a peer review system would enhance collaboration.	12	False		False
356	162	must work on accepting feedback without defensiveness	6	False		False
357	1	the team's collaborative approach could be more structured for larger projects	12	False		False
358	547	i'm not taking enough time to reflect on my work and identify areas for improvement.	11	False		False
359	621	the lack of clear ownership for project tasks leads to confusion during handoffs.	11	False		False
360	810	course instructors need to provide more detailed written feedback on assignments.	1	False		False
361	651	the course content often assumes prior knowledge that students may not have.	10	False		False
362	154	rarely receive guidance on how to improve performance	6	False		False
363	789	i need to be more proactive in identifying and addressing bottlenecks.	11	False		False
364	809	i should make time to reflect on my progress and adjust goals as needed.	0	False		False
365	820	course workload needs adjustment to allow for more hands-on learning.	5	False		False
366	909	i need to be more disciplined in following through on action items.	4	False		False
367	343	the project's timeline didn't allow for adequate risk analysis.	14	False		False
368	445	frequent conflicts over responsibilities create tension within the team.	12	False		False
369	345	the course's assignments don't align with learning objectives; revising them for relevance would improve outcomes.	1	False		False
370	145	need more training on how to handle disagreements	12	False		False
371	615	the training modules often focus on theory rather than hands-on practice for new tools.	5	False		False
372	511	i'm not setting clear boundaries for personal tasks and team responsibilities.	11	False		False
373	943	the feedback from clients is too vague to implement meaningful improvements.	6	False		False
374	486	i'm not setting clear boundaries for personal tasks and team responsibilities.	11	False		False
375	400	i need to take more initiative in project planning to grow my leadership skills.	8	False		False
376	586	the course syllabus doesn't provide enough opportunities for hands-on practice.	13	False		False
377	707	the training program needs more interactive elements to engage participants actively.	5	False		False
378	732	i must improve my ability to delegate tasks confidently and trust team capabilities.	8	False		False
379	661	the team needs better systems for tracking shared knowledge across members.	12	False		False
380	916	i need more hands-on practice to enhance my proficiency in python programming.	8	False		False
381	595	i should explore networking opportunities to expand my professional knowledge.	8	False		False
382	703	the course content needs more diverse perspectives to address different learning needs.	10	False		False
383	886	course workload needs adjustment to allow for more hands-on learning.	5	False		False
384	140	frequent multitasking reduces overall quality of work	0	False		False
385	952	i should explore new tools or software that can streamline my daily workflow.	7	False		False
386	811	i need to be more disciplined in following through on action items.	4	False		False
387	987	frequent interruptions during focused work reduce overall productivity and task quality.	0	False		False
388	355	the project's scope creep wasn't managed effectively; enforcing change control processes would improve planning.	9	False		False
389	111	could benefit from more structured onboarding for new projects	3	False		False
390	188	frequent ambiguity around task priorities causes confusion	11	False		False
391	114	must work on developing better listening skills	4	False		False
392	531	i'm not leveraging peer reviews to improve my work quality.	11	False		False
393	104	frequent ambiguity around task priorities causes confusion	11	False		False
394	769	creating more opportunities for cross-departmental collaboration could drive innovation.	12	False		False
395	912	i need to improve my time management skills to meet project deadlines.	0	False		False
396	90	struggling to find time for professional development	8	False		False
397	469	frequent miscommunication about deadlines leads to missed targets.	2	False		False
398	667	the course content needs more practical examples to illustrate theoretical concepts.	10	False		False
399	571	i need to improve my ability to accept feedback and use it for growth.	6	False		False
400	620	i should schedule regular knowledge-sharing sessions to capitalize on team expertise.	12	False		False
401	112	frequent multitasking reduces overall quality of work	0	False		False
402	921	i need to develop better note-taking strategies during lectures to retain information.	4	False		False
403	687	the training program should include more hands-on practice for complex technical skills.	8	False		False
404	72	frequent ambiguity around task priorities causes confusion	11	False		False
405	383	the project's documentation lacks version history; implementing a tracking system would improve traceability.	2	False		False
406	767	workshops on effective delegation would improve team coordination.	12	False		False
407	303	the project's documentation is inconsistent; implementing standardized templates would improve quality.	2	False		False
408	806	implementing a feedback culture requires training in how to give and receive input.	6	False		False
409	167	could benefit from more structured onboarding for new projects	3	False		False
410	8	timely feedback on assignments would improve learning outcomes	1	False		False
411	109	rarely get feedback on my ability to collaborate with others	6	False		False
412	524	frequent delays in project milestones create unnecessary pressure.	9	False		False
413	509	i should use templates to streamline repetitive tasks and improve efficiency.	7	False		False
414	898	workshops on effective communication could improve team collaboration.	12	False	medium	True
415	124	must work on managing time between competing priorities	0	False		False
416	122	could improve my ability to explain technical concepts clearly	4	False		False
417	694	i'm not setting clear expectations with team members for project deliverables.	2	False		False
418	231	my tendency to micromanage stifles team ownership; practicing trust-building could improve collaboration.	12	False		False
419	745	team dynamics suffer when roles are unclear, leading to overlap and inefficiency.	2	False		False
420	907	i must be more mindful of how my communication style affects team dynamics.	12	False		False
421	714	collaboration between departments is often hindered by unclear communication channels.	2	False		False
422	465	frequent disagreements over work methods are slowing down progress.	2	False		False
423	964	i should focus on improving my ability to document technical processes clearly.	8	False		False
424	50	rarely get feedback on non-technical skills	6	False		False
425	310	i need to practice more structured feedback; adopting frameworks like sbi would help.	6	False		False
426	609	i've been avoiding difficult conversations about project priorities, which delays decision-making.	9	False		False
427	774	creating standardized templates for project documentation would improve clarity.	2	False		False
428	460	i should focus on developing skills that align with long-term goals.	8	False	medium	True
429	366	my tendency to avoid difficult conversations hinders team growth; learning conflict resolution techniques would improve this.	12	False		False
430	477	the course syllabus is too rigid; more flexibility would benefit learners.	10	False		False
431	491	the team's feedback process is inconsistent across different members.	6	False		False
432	741	improving documentation for common processes would reduce confusion and errors.	2	False		False
433	426	the course isn't accessible for students with disabilities; more accommodations are needed.	13	False		False
434	189	limited understanding of how to handle constructive criticism	4	False		False
435	237	my communication style is direct but sometimes perceived as harsh; practicing empathy in feedback would help.	4	False		False
436	230	the lab's instructions are inconsistent across sections; standardizing them would reduce confusion.	1	False		False
437	678	i struggle with providing balanced feedback that acknowledges both strengths and areas for growth.	6	False		False
438	925	team members often interrupt each other, which disrupts productive discussions.	12	False		False
439	350	i need to improve my listening skills during feedback sessions; practicing active listening would help.	4	False		False
440	371	the project's documentation is inconsistent; implementing standardized templates would improve quality.	2	False		False
441	222	the lecture's complex concepts require more visual aids; adding diagrams would enhance learning.	10	False		False
442	856	creating a shared calendar system would help with team coordination.	12	False		False
443	453	the course isn't tailored to different learning paces, causing some students to fall behind.	10	False		False
444	198	must work on developing better listening skills	4	False		False
445	733	the lack of mentorship opportunities limits growth for junior staff.	3	False		False
446	945	there's a lack of clear guidelines for resolving conflicts within the team.	2	False		False
447	66	must work on asking for feedback more proactively	6	False		False
448	302	i need to improve my ability to delegate complex tasks; practicing trust-building would help.	8	False		False
449	930	i need to strengthen my ability to give and receive constructive feedback.	4	False		False
450	34	frequent multitasking reduces overall efficiency	0	False		False
451	906	creating a centralized knowledge repository would improve access to important information.	12	False		False
452	727	the project scope is often unclear, which leads to rework and frustration.	9	False		False
453	286	i need to improve my ability to delegate; practicing trust-building techniques would enhance team dynamics.	12	False		False
454	461	the team's feedback process lacks follow-up actions, making it less effective.	6	False		False
455	527	i need to improve my ability to give and receive feedback professionally.	4	False		False
456	681	the team's knowledge-sharing practices could be more structured for consistency.	12	False		False
457	855	i should focus on building stronger relationships with mentors for guidance.	3	False		False
458	523	i need to practice summarizing key points in meetings.	4	False		False
459	603	the team's lack of cross-training is creating bottlenecks in our workflow.	2	False		False
460	654	i struggle to provide constructive feedback without sounding critical in group settings.	6	False		False
461	572	the course content is too dense; more spaced-out lessons would help retention.	10	False		False
462	821	i must improve my time management to avoid overcommitting myself.	0	False		False
463	349	the course's content assumes prior knowledge not covered; suggesting prerequisite modules would help.	10	False		False
464	293	the course's feedback is too generic; providing specific examples would help learners improve.	1	False		False
465	319	the project's budgeting process lacked contingency planning; adding buffer funds would mitigate risks.	14	False		False
466	98	rarely receive guidance on how to improve performance	6	False		False
467	113	limited access to learning resources outside core responsibilities	5	False		False
468	600	i've noticed that my tendency to delay feedback until the last minute often creates unnecessary pressure.	6	False		False
469	199	could improve my ability to ask clarifying questions	4	False		False
470	130	must work on developing better documentation habits	2	False		False
471	212	the course's assessment methods don't reflect real-world challenges; incorporating practical tasks would help.	13	False		False
472	384	the team's use of terminology is inconsistent; creating a shared glossary would improve alignment.	2	False		False
473	241	i need to improve my ability to delegate complex tasks; practicing trust-building with the team would help.	8	False		False
474	569	i should use templates to streamline repetitive tasks and improve efficiency.	7	False		False
475	698	i should focus more on developing emotional intelligence to improve team interactions.	12	False		False
476	564	frequent misalignment between team goals creates confusion.	2	False		False
477	76	few opportunities to practice leadership skills	8	False		False
478	420	i should document my workflow to increase efficiency and reduce errors.	7	False		False
479	812	workshops on effective communication could improve team collaboration.	12	False		False
480	28	ideas from junior members are often overlooked	12	False		False
481	55	limited opportunities to practice public speaking	4	False		False
482	696	i struggle with accepting feedback that challenges my assumptions about team dynamics.	6	False		False
483	32	struggling to keep up with rapidly changing project requirements	9	False		False
484	721	i should take initiative in identifying areas for personal skill development.	8	False		False
485	209	my public speaking skills need refinement; practicing with recorded replays might help.	4	False		False
486	497	the course material is too dense; more spaced-out lessons would help retention.	10	False		False
487	908	course workload needs adjustment to allow for more hands-on learning.	5	False		False
488	53	frequent ambiguity around project goals causes confusion	9	False		False
489	981	frequent changes in project scope due to poor planning cause wasted effort.	9	False	medium	True
490	674	i need to improve my ability to ask for feedback in a way that encourages open dialogue.	4	False		False
491	173	need more training on how to handle disagreements	12	False		False
492	21	must work on delivering constructive feedback to peers	6	False		False
493	836	workshops on effective communication could improve team collaboration.	12	False		False
494	538	the course isn't tailored to different learning paces, causing some students to fall behind.	10	False		False
495	143	could improve my ability to ask clarifying questions	4	False		False
496	506	the course syllabus doesn't provide enough flexibility for personal learning goals.	13	False		False
497	983	the team's performance reviews are too generic and do not address individual areas for growth.	2	False		False
498	378	i need to practice more structured feedback; adopting frameworks like the star method would help.	6	False		False
499	833	i should make time to reflect on my progress and adjust goals as needed.	0	False		False
500	172	frequent changes in project scope create confusion	9	False		False
501	552	the team's feedback is inconsistent, making it hard to understand expectations.	6	False		False
502	720	the workshop lacks hands-on activities that would make the subject more engaging.	13	False		False
503	516	the team's feedback lacks actionable steps, making it less helpful.	6	False		False
504	816	course content should include real-world case studies for better contextual learning.	10	False		False
505	65	frequent changes in team composition create instability	2	False		False
506	742	i should work on being more receptive to feedback, especially when it's critical.	6	False		False
507	148	few opportunities to share knowledge with peers	12	False		False
508	82	must work on accepting feedback without defensiveness	6	False		False
