index	feedback_id	text	cluster_label	is_labeled	label	labeled
509	211	the team's collaborative tools are outdated; upgrading to a modern platform could improve efficiency.	2	False		False
510	298	my communication style is direct but sometimes perceived as harsh; practicing empathy would improve clarity.	4	False		False
511	579	i should use project management tools to organize my tasks more effectively.	7	False		False
512	604	i prefer written over verbal critiques to avoid miscommunication about project requirements.	2	False		False
513	931	the team's decision-making process is too slow, delaying necessary actions.	2	False		False
514	759	team members should be trained on conflict resolution techniques to manage disagreements.	12	False		False
515	471	the team's feedback is often delayed, which reduces its impact.	6	False		False
516	573	i should use a task tracker to monitor progress on my projects.	11	False		False
517	240	the course's assessment criteria are unclear; providing detailed rubrics would enhance student understanding.	1	False		False
518	94	could improve my ability to explain technical concepts clearly	4	False		False
519	786	creating a more structured feedback framework would increase actionability.	6	False		False
520	885	i must be more mindful of how my communication style affects team dynamics.	12	False		False
521	911	i should focus on improving my ability to think strategically about long-term goals.	8	False		False
522	207	the team's conflict resolution process feels informal; establishing a formal protocol could help.	12	False		False
523	508	the course content is too theoretical and lacks practical application examples.	13	False		False
524	948	i should practice more to improve my speed and accuracy in data entry tasks.	8	False		False
525	611	i'm not utilizing the mentorship program enough to accelerate my professional development.	3	False	medium	True
526	840	course content should include real-world case studies for better contextual learning.	10	False		False
527	200	the team's communication during the sprint planning was unclear, leading to duplicated tasks.	2	False		False
528	530	frequent disagreements over work methods are slowing down progress.	2	False		False
529	182	rarely receive guidance on how to improve performance	6	False		False
530	36	limited access to industry-specific training resources	5	False		False
531	311	the project's resource allocation was unbalanced; using workload balancing tools could improve efficiency.	11	False		False
532	26	meetings often start late and end without clear next steps	2	False		False
533	127	must work on setting clearer personal development goals	8	False		False
534	934	i must work on managing stress to maintain focus during high-pressure situations.	0	False		False
535	174	struggling to find time for professional development	8	False		False
536	348	the team's workflow lacks automation; identifying repetitive tasks for tooling could improve efficiency.	2	False		False
537	558	frequent disagreements about project timelines slow down progress.	9	False		False
538	164	few opportunities to practice time management techniques	0	False		False
539	758	i should develop a habit of reflecting on weekly achievements and challenges.	8	False		False
540	901	i need to be more concise in my emails and written communication.	4	False		False
541	357	the course's content delivery is passive; incorporating real-world case studies would improve relevance.	10	False		False
542	75	could improve my ability to give feedback without being vague	6	False		False
543	421	the team's feedback process feels unstructured and unproductive.	6	False		False
544	568	frequent delays in project milestones create unnecessary pressure.	9	False		False
545	498	i need to practice being more assertive in expressing my ideas.	4	False		False
546	544	frequent changes in requirements make it hard to stay focused.	9	False		False
547	888	course instructors need to provide more personalized guidance for struggling students.	1	False		False
548	852	creating a structured feedback framework would increase actionability.	6	False		False
549	452	i need to practice empathy during team discussions.	12	False		False
550	99	must work on setting clearer personal development goals	8	False		False
551	285	the course's content doesn't address diverse learning styles; incorporating multimedia resources would help.	10	False		False
552	170	must work on developing better listening skills	4	False		False
553	430	the team's feedback is inconsistent, making it hard to understand expectations.	6	False		False
554	751	i need to reduce multitasking to improve focus and task completion quality.	0	False		False
555	37	need clearer guidelines for handling conflicts in team settings	2	False		False
556	941	team members often have conflicting priorities, leading to delays in project delivery.	2	False		False
557	734	creating a shared knowledge base would enhance skill-sharing across departments.	12	False		False
558	414	some tasks are unclear, leading to redundant work and frustration.	11	False		False
559	867	i must be more mindful of how my communication style affects team dynamics.	12	False		False
560	763	i need to practice more active listening when receiving feedback.	4	False		False
561	263	the project's task dependencies weren't clearly mapped, causing delays.	9	False		False
562	711	the team needs better systems for documenting shared knowledge to improve collaboration.	12	False		False
563	255	the project's budgeting process lacks contingency planning; adding buffer funds would mitigate risks.	14	False		False
564	837	i should focus on building stronger relationships with mentors for guidance.	3	False		False
565	290	my feedback to peers often lacks actionable steps; learning frameworks like the star method would help.	6	False		False
566	155	must work on setting clearer personal development goals	8	False		False
567	144	frequent changes in project scope create confusion	9	False		False
568	825	i need to focus on improving my ability to think strategically about long-term goals.	8	False		False
569	425	meetings often lack clear agendas, leading to wasted time.	2	False		False
570	440	the team's feedback sessions are infrequent and not actionable.	6	False		False
571	478	i need to practice giving feedback in a way that's respectful and constructive.	4	False		False
572	439	i should explore new learning platforms to expand my knowledge.	8	False		False
573	702	i often give feedback that's too vague to be useful for improvement.	6	False		False
574	142	must work on developing better listening skills	4	False		False
575	438	frequent multitasking reduces the quality of my work.	0	False		False
576	121	must work on asking for feedback more proactively	6	False		False
577	800	course modules should be more interactive to increase student engagement.	10	False		False
578	772	team members must learn to communicate their workload transparently.	12	False		False
579	567	i need to practice being more concise in my communication.	4	False		False
580	920	the feedback loop between departments is unclear, leading to duplicated efforts.	2	False		False
581	663	the training program's assessment methods don't accurately reflect real-world application.	13	False		False
582	988	i should seek out workshops or training programs to strengthen my analytical skills.	8	False		False
583	817	i need to be more organized in my workflow to manage multiple projects efficiently.	7	False		False
584	386	my tendency to avoid difficult conversations hinders team growth; learning conflict resolution techniques would improve this.	12	False		False
585	870	course instructors need to provide more detailed written feedback on assignments.	1	False		False
586	236	the lecture's examples were too simplistic; including advanced scenarios would better prepare students for challenges.	10	False		False
587	876	workshops on effective communication could improve team collaboration.	12	False		False
588	168	frequent multitasking reduces overall quality of work	0	False		False
589	185	few clear guidelines on how to handle project delays	9	False		False
590	163	could improve my ability to listen actively during discussions	4	False		False
591	583	i should use a planner to better manage my time and reduce stress.	0	False		False
592	315	the project's documentation lacks version history; implementing a tracking system would improve traceability.	2	False		False
593	48	struggling to find time for professional development activities	8	False		False
594	589	i should use templates to streamline repetitive tasks and improve efficiency.	7	False		False
595	525	i should focus on developing skills that align with long-term goals.	8	False		False
596	868	course workload needs adjustment to allow for more hands-on learning.	5	False		False
597	23	need better tools for tracking team performance metrics	2	False		False
598	13	feedback is rarely given in a timely manner	6	False		False
599	88	frequent changes in project scope create confusion	9	False		False
600	334	i need to practice more structured feedback; adopting frameworks like the star method would help.	6	False		False
601	399	the project's resource allocation was unbalanced; using workload balancing tools could improve efficiency.	11	False		False
602	160	frequent ambiguity around task priorities causes confusion	11	False		False
603	826	team members should be trained in basic project management principles.	12	False		False
604	528	the course syllabus doesn't provide enough opportunities for hands-on practice.	13	False		False
605	448	i need to improve my ability to present complex information clearly.	4	False		False
606	409	i need to ask for clarifications more often to avoid misunderstandings.	4	False		False
607	161	limited understanding of how to handle constructive criticism	4	False		False
608	562	the course isn't providing enough opportunities for hands-on practice.	13	False		False
609	550	frequent miscommunication about deadlines leads to missed targets.	2	False		False
610	307	the project's timeline didn't allow for adequate risk analysis.	14	False		False
611	929	the feedback provided during reviews lacks specific examples of areas needing improvement.	6	False		False
612	950	i need to improve my ability to manage deadlines without sacrificing quality.	0	False		False
613	54	could benefit from more practice in leading team discussions	12	False		False
614	276	the team's collaboration lacks transparency; implementing shared status updates would enhance accountability.	2	False		False
615	783	i should make a habit of setting clear goals for each work cycle.	0	False		False
616	723	the software tools we use could be better integrated with our workflow systems.	7	False		False
617	894	creating a shared calendar system would help with team coordination.	12	False		False
618	73	limited understanding of how to handle constructive criticism	4	False		False
619	770	the course lacks sufficient practice exercises for mastering technical concepts.	13	False		False
620	429	i should seek out more collaborative projects to enhance teamwork skills.	12	False		False
621	63	need more guidance on how to handle disagreements	2	False		False
622	80	frequent multitasking reduces overall quality of work	0	False		False
623	633	the training content often lacks real-world application scenarios for complex concepts.	13	False		False
624	74	must work on developing better documentation habits	2	False		False
625	887	i need to be more disciplined in following through on action items.	4	False		False
626	12	mentoring programs should include more hands-on practice	3	False		False
627	395	the project's scope creep wasn't managed effectively; enforcing change control processes would improve planning.	9	False		False
628	457	the course content is too advanced for beginners; more foundational lessons are needed.	10	False		False
629	210	the project deadline was unrealistic given the scope; renegotiating timelines is necessary.	14	False		False
630	784	workshops on negotiation skills could improve conflict resolution and agreement outcomes.	12	False		False
631	416	our group needs better conflict resolution strategies during disagreements.	12	False		False
632	214	the onboarding process lacks personalized guidance; assigning mentors per new hire would improve retention.	3	False		False
633	67	could improve my ability to listen actively during discussions	4	False		False
634	750	implementing a feedback culture requires training in how to give and receive input.	6	False		False
635	150	could improve my ability to explain technical concepts clearly	4	False		False
636	434	frequent miscommunication between team members leads to delays.	2	False		False
637	993	frequent misunderstandings between team members indicate a need for better communication protocols.	2	False		False
638	822	workshops on negotiation skills could improve conflict resolution and agreement outcomes.	12	False		False
639	91	could benefit from more practice in leading discussions	12	False		False
640	304	the team's workflow lacks automation; identifying repetitive tasks for tooling could free up time.	2	False		False
641	802	team members should be encouraged to share their unique perspectives more freely.	12	False		False
642	25	need more guidance on balancing workload with personal projects	11	False		False
643	966	i need to practice better prioritization techniques to avoid burnout.	7	False		False
644	726	workshops on conflict resolution could enhance team cohesion during disagreements.	12	False		False
645	159	could benefit from more training on using collaboration tools	12	False		False
646	196	frequent multitasking reduces overall quality of work	0	False		False
647	178	could improve my ability to explain technical concepts clearly	4	False		False
648	363	the project's documentation lacks version history; implementing a tracking system would improve traceability.	2	False		False
649	760	the course syllabus needs better alignment with industry-relevant skills.	10	False		False
650	485	frequent interruptions during focused work reduce overall output quality.	0	False		False
651	489	frequent misalignment between team goals creates confusion.	2	False		False
652	891	i must be more proactive in identifying and addressing bottlenecks.	11	False		False
653	256	the team's documentation practices are inconsistent; implementing version-controlled templates could improve quality.	2	False		False
654	818	implementing regular peer coaching sessions would enhance team growth.	12	False		False
655	282	my tendency to micromanage stifles innovation; fostering autonomy would improve team performance.	12	False		False
656	306	my feedback style is overly technical; simplifying language would make it more accessible.	6	False		False
657	184	could improve my ability to provide specific examples in feedback	4	False		False
658	436	the course syllabus is unclear, making it hard to plan study time.	10	False		False
659	341	the course's feedback mechanisms are delayed; real-time evaluation tools could enhance learning.	10	False		False
660	967	the feedback from team members is often too vague to act on effectively.	6	False		False
661	215	the team's meetings often run over time; implementing a strict agenda would help.	2	False		False
662	31	mentorship programs should include more one-on-one time	3	False		False
663	504	i should use a planner to better manage my time and reduce stress.	0	False		False
664	308	the team's collaboration lacks transparency; implementing shared dashboards would improve efficiency.	2	False		False
665	979	there's a lack of clear guidelines for resolving disagreements within the team.	2	False		False
666	423	there's a lack of mentorship opportunities for skill development.	3	False		False
667	323	the project's timeline didn't allow for adequate user testing.	14	False		False
668	257	the course's reading lists are too long; curating essential texts would reduce overwhelm.	10	False		False
669	597	i need to improve my ability to ask for help when needed.	4	False		False
670	291	the project's budgeting process didn't account for hidden costs; better forecasting would improve planning.	14	False		False
671	879	i need to be more concise in my emails and written communication.	4	False		False
672	792	implementing team retrospectives would help identify process improvements.	2	False		False
673	903	i must be more proactive in identifying and addressing bottlenecks.	11	False		False
674	123	limited understanding of how team dynamics impact productivity	12	False		False
675	340	the team's knowledge-sharing is ad hoc; scheduling regular skill share sessions would improve efficiency.	12	False		False
676	715	the course material could use more practical examples to reinforce concepts.	10	False	medium	True
677	272	the team's use of feedback is inconsistent; providing training on its implementation could help.	6	False		False
678	93	must work on asking for feedback more proactively	6	False		False
679	749	workshops on effective goal-setting would improve individual and team performance.	12	False		False
680	235	the team's knowledge-sharing sessions are infrequent; scheduling monthly skill swaps would enhance collective expertise.	12	False		False
681	470	i should use a planner or digital tools to better organize my workflow.	7	False		False
682	18	communication between departments is often delayed	2	False		False
683	591	i'm not utilizing available mentorship opportunities to improve my skills.	3	False		False
684	521	i'm not taking enough time to reflect on my learning experiences.	5	False		False
685	83	few clear guidelines on how to handle conflicts	2	False		False
686	844	course instructors need to provide more detailed written feedback on assignments.	1	False		False
687	938	i should seek out more opportunities for professional development in my field.	8	False		False
688	877	i should make time to reflect on my progress and adjust goals as needed.	0	False		False
689	339	the project's documentation lacks version history; implementing a tracking system would improve traceability.	2	False		False
690	216	the lab exercises require prerequisites not clearly listed; adding pre-requisite checks would be helpful.	13	False		False
691	326	i need to improve my ability to give specific, actionable feedback; practicing frameworks like the star method would help.	6	False		False
692	697	the team needs better protocols for documenting project decisions to avoid repeated discussions.	2	False	medium	True
693	622	i tend to overcommit during meetings, which affects my ability to follow through on all promises.	4	False		False
694	754	i should take more initiative in seeking out learning opportunities beyond my role.	8	False		False
695	100	could improve my ability to provide specific examples in feedback	4	False		False
696	479	frequent changes in project scope make it hard to maintain quality.	9	False		False
697	636	i'm not practicing active listening during meetings, which reduces team collaboration effectiveness.	12	False		False
698	266	my reluctance to ask for help leads to inefficiencies; fostering a culture of inquiry would improve teamwork.	12	False		False
699	553	i need to improve my ability to ask for clarification when instructions are unclear.	1	False		False
700	722	our team's feedback loops often lack specificity, leading to vague improvements.	6	False		False
701	14	need clearer expectations for cross-functional collaboration	12	False		False
702	297	the course's content assumes prior knowledge not covered; suggesting prerequisite modules would help.	10	False		False
703	193	rarely get feedback on my ability to collaborate with others	6	False		False
704	379	the project's resource allocation was unbalanced; using workload balancing tools could improve efficiency.	11	False		False
705	474	i should set specific times for focused work to avoid distractions.	0	False		False
706	191	could improve my ability to listen actively during discussions	4	False		False
707	875	i must be more organized in my workflow to manage multiple projects efficiently.	7	False	medium	True
708	456	i'm not leveraging peer reviews to improve my work quality.	11	False		False
709	254	i avoid giving negative feedback; learning to frame it constructively would improve team development.	6	False		False
710	813	i should focus on improving my ability to think strategically about long-term goals.	8	False		False
711	910	course instructors need to provide more personalized guidance for struggling students.	1	False		False
712	442	some tasks are not aligned with our team's goals, leading to confusion.	2	False		False
713	157	few clear guidelines on how to handle project delays	9	False		False
714	17	i need to improve my ability to ask for help when stuck	4	False		False
715	897	i must be more organized in my workflow to manage multiple projects efficiently.	7	False		False
716	166	must work on managing my time more effectively	0	False		False
717	351	the project's budgeting process lacked contingency planning; adding buffer funds would mitigate risks.	14	False		False
718	846	creating a centralized knowledge repository would improve access to important information.	12	False		False
719	180	must work on managing time between competing priorities	0	False		False
720	781	i need to be more mindful of how my communication style affects team dynamics.	12	False		False
721	15	take more time to document solutions for future reference	7	False		False
722	424	i should review my work more thoroughly before submitting.	11	False		False
723	368	the team's collaboration lacks transparency; implementing shared dashboards would improve efficiency.	2	False		False
724	228	the mentorship program's goals are vague; defining measurable milestones would improve outcomes.	3	False		False
725	218	the project's scope was ambiguous, causing confusion about deliverables.	9	False		False
726	706	i'm not utilizing my peer feedback as effectively as i could to improve team performance.	6	False		False
727	679	the training program lacks sufficient practice opportunities for applying new skills.	13	False		False
728	501	the team's feedback lacks specificity, making it hard to know what needs improvement.	6	False		False
729	156	could improve my ability to provide specific examples in feedback	4	False		False
730	625	the training program needs more mentorship opportunities for hands-on learning.	3	False		False
731	321	the course's assignments don't align with learning objectives; revising them for relevance would improve outcomes.	1	False		False
732	606	i should set clearer expectations for deliverables to reduce rework and confusion.	11	False		False
733	766	i should focus on building stronger relationships with mentors and peers.	3	False		False
734	455	frequent distractions during work hours reduce overall productivity.	0	False		False
735	78	must work on managing my time more effectively	0	False		False
736	899	i should make time to reflect on my progress and adjust goals as needed.	0	False		False
737	873	i need to be more open to receiving constructive criticism without defensiveness.	4	False		False
738	922	there's a lack of clarity in role definitions, which causes confusion during tasks.	2	False		False
739	317	the course's feedback mechanisms are delayed; real-time evaluation tools could enhance learning.	10	False		False
740	731	adopting agile methodologies could streamline our workflow and increase productivity.	7	False		False
741	394	my communication style is direct but sometimes perceived as harsh; practicing empathy would improve clarity.	4	False		False
742	288	the team's workflow lacks automation; identifying repetitive tasks for tooling could improve efficiency.	2	False		False
743	677	the team needs clearer role definitions to avoid overlapping responsibilities.	2	False		False
744	278	i need to practice more structured feedback; adopting frameworks like the situation-complication-resolution model would help.	6	False		False
745	35	must work on accepting feedback without defensiveness	6	False		False
746	47	frequent changes in leadership create uncertainty	2	False		False
747	433	i should break down complex tasks into smaller, manageable steps.	7	False		False
748	803	i need to be more efficient in my workflow by avoiding multitasking.	7	False		False
749	292	the team's knowledge-sharing is ad hoc; scheduling regular cross-departmental workshops would improve efficiency.	12	False		False
750	690	i'm not utilizing the feedback i receive to make consistent, measurable improvements.	6	False		False
751	133	limited understanding of how to handle constructive criticism	4	False		False
752	244	my feedback to peers sometimes lacks specificity; learning structured frameworks would improve clarity.	6	False		False
753	949	the company needs better systems for tracking and addressing employee concerns.	11	False		False
754	994	i should focus on improving my ability to document technical processes clearly.	8	False		False
755	838	creating a shared calendar system would help with team coordination.	12	False		False
756	883	i should focus on improving my ability to think strategically about long-term goals.	8	False		False
757	252	the team's conflict resolution methods are inconsistent; providing training could improve consistency.	2	False		False
758	747	more opportunities for cross-training would broaden individual skill sets.	8	False		False
759	946	i need to develop stronger organizational skills to manage multiple projects efficiently.	8	False		False
760	481	the team's feedback lacks actionable steps, making it less helpful.	6	False		False
761	328	the team's knowledge-sharing is ad hoc; scheduling regular workshops would enhance collaboration.	12	False		False
762	410	the team's communication style is too informal, leading to confusion.	2	False		False
763	435	i'm not utilizing available resources to improve my skills.	5	False		False
764	944	i must improve my ability to adapt to changing project requirements.	9	False		False
765	682	i find it difficult to provide feedback that's both honest and constructive in time-sensitive situations.	6	False		False
