index	feedback_id	text	cluster_label	is_labeled	label	labeled
766	896	course content needs more emphasis on critical thinking and application of concepts.	10	False		False
767	52	limited access to performance evaluation templates	7	False		False
768	336	the team's collaboration lacks transparency; implementing shared dashboards would improve efficiency.	2	False		False
769	204	the mentorship program lacks structure; defining clear goals for each session would improve outcomes.	3	False		False
770	132	frequent ambiguity around task priorities causes confusion	11	False		False
771	848	course workload needs adjustment to allow for more hands-on learning.	5	False		False
772	312	the team's use of feedback is inconsistent; providing training on its implementation could help.	6	False		False
773	927	frequent changes in project scope without proper communication create frustration.	9	False		False
774	79	could benefit from more structured onboarding for new projects	3	False		False
775	653	the team needs better practices for documenting decisions to avoid repeated discussions.	2	False		False
776	659	the course's feedback system could be improved with more specific, actionable suggestions.	10	False		False
777	808	creating standardized templates for project documentation would improve clarity.	2	False		False
778	68	few opportunities to practice time management techniques	0	False		False
779	693	the training content needs more real-world application scenarios for complex concepts.	10	False		False
780	835	i must be more organized in my workflow to manage multiple projects efficiently.	7	False		False
781	370	i need to improve my ability to delegate; practicing trust-building techniques would enhance team dynamics.	12	False		False
782	785	i need to be more concise in my emails and written communication.	4	False		False
783	515	i should explore networking opportunities to expand my professional knowledge.	8	False		False
784	881	i must be more proactive in identifying and addressing bottlenecks.	11	False		False
785	585	i'm not taking enough time to reflect on my learning experiences.	5	False		False
786	262	i need to improve my listening skills during feedback sessions; practicing active listening would help.	4	False		False
787	843	i need to be more efficient in my workflow by avoiding multitasking.	7	False		False
788	857	i need to be more open to receiving constructive criticism without defensiveness.	4	False		False
789	598	the course material is too dense; more spaced-out lessons would help retention.	10	False		False
790	487	the course syllabus doesn't adequately prepare students for real-world challenges.	13	False		False
791	3	frequent interruptions during focused work time reduce output quality	0	False		False
792	118	struggling to find time for professional development	8	False		False
793	422	i need to practice time-blocking techniques to manage my workload better.	0	False		False
794	794	course instructors need to provide more personalized guidance for struggling students.	1	False		False
795	522	the course materials are outdated and don't reflect current industry practices.	13	False		False
796	596	the team's feedback lacks actionable steps, making it less helpful.	6	False		False
797	672	i often focus on quantity over quality when giving peer feedback, which is less helpful.	6	False		False
798	446	i'm not setting clear boundaries for task ownership.	11	False		False
799	325	the course's content assumes prior knowledge not covered; suggesting prerequisite modules would help.	10	False		False
800	238	the project's timeline included buffer periods; better resource planning could prevent burnout.	14	False		False
